{
  "bundleVersion": "research-evidence-bundle-v1",
  "sourceId": "synthetic-source-v1",
  "policyVersion": "synthetic-policy-v1",
  "sourceDocumentFingerprint": "aaaaaaaaaaaaaaaaaaaaaaaaaaaaaaaaaaaaaaaaaaaaaaaaaaaaaaaaaaaaaaaa",
  "entries": [
    {
      "content": {
        "bundleVersion": "research-evidence-bundle-v1",
        "sourceId": "synthetic-source-v1",
        "policyVersion": "synthetic-policy-v1",
        "sourceDocumentFingerprint": "aaaaaaaaaaaaaaaaaaaaaaaaaaaaaaaaaaaaaaaaaaaaaaaaaaaaaaaaaaaaaaaa",
        "evidenceKey": "synthetic-calendar",
        "kind": "CALENDAR",
        "instrumentId": "11111111-1111-4111-8111-111111111111",
        "interval": {
          "startAt": "2026-10-23T00:00:00Z",
          "endAt": "2026-10-24T00:00:00Z"
        },
        "sourceObservedAt": "2026-10-26T09:00:00Z",
        "publishedAt": null,
        "revision": 1,
        "predecessorFingerprint": null,
        "statement": {
          "type": "CALENDAR_SESSIONS",
          "calendarVersion": "synthetic-calendar-v1",
          "sessions": [
            {
              "sessionDate": "2026-10-23",
              "opensAt": "2026-10-23T13:30:00Z",
              "closesAt": "2026-10-23T20:00:00Z"
            }
          ]
        },
        "signedAt": "2026-10-26T09:00:01Z",
        "keyId": "synthetic-source-key-v1"
      },
      "contentFingerprint": "6b480bfac2a7519a32275df1a2ac5c4c6b658a61b2a5e2844906b01448292d29",
      "signature": {
        "algorithm": "Ed25519",
        "canonicalization": "RFC8785-UTF8-v1",
        "keyId": "synthetic-source-key-v1",
        "value": "AAAAAAAAAAAAAAAAAAAAAAAAAAAAAAAAAAAAAAAAAAAAAAAAAAAAAAAAAAAAAAAAAAAAAAAAAAAAAAAAAAAAAA=="
      }
    }
  ]
}
