{
  "bundleVersion": "research-evidence-bundle-v1",
  "sourceId": "synthetic-source-v1",
  "policyVersion": "synthetic-policy-v1",
  "sourceDocumentFingerprint": "aaaaaaaaaaaaaaaaaaaaaaaaaaaaaaaaaaaaaaaaaaaaaaaaaaaaaaaaaaaaaaaa",
  "entries": [
    {
      "content": {
        "bundleVersion": "research-evidence-bundle-v1",
        "sourceId": "synthetic-source-v1",
        "policyVersion": "synthetic-policy-v1",
        "sourceDocumentFingerprint": "aaaaaaaaaaaaaaaaaaaaaaaaaaaaaaaaaaaaaaaaaaaaaaaaaaaaaaaaaaaaaaaa",
        "evidenceKey": "synthetic-quality",
        "kind": "QUALITY",
        "instrumentId": "11111111-1111-4111-8111-111111111111",
        "interval": {
          "startAt": "2026-10-23T00:00:00Z",
          "endAt": "2026-10-24T00:00:00Z"
        },
        "sourceObservedAt": "2026-10-26T09:00:00Z",
        "publishedAt": null,
        "revision": 1,
        "predecessorFingerprint": null,
        "statement": {
          "type": "QUALITY_OBSERVATION",
          "quality": "VALID",
          "ruleVersion": "research-quality-v1",
          "reason": "NORMALIZED_RULES_PASSED"
        },
        "signedAt": "2026-10-26T09:00:01Z",
        "keyId": "synthetic-source-key-v1"
      },
      "contentFingerprint": "5ca522c4f23f9516345932fcc933c6b821f129aead4e1aedc7421121eddbf9a3",
      "signature": {
        "algorithm": "Ed25519",
        "canonicalization": "RFC8785-UTF8-v1",
        "keyId": "synthetic-source-key-v1",
        "value": "AAAAAAAAAAAAAAAAAAAAAAAAAAAAAAAAAAAAAAAAAAAAAAAAAAAAAAAAAAAAAAAAAAAAAAAAAAAAAAAAAAAAAA=="
      },
      "temporalProof": {
        "payload": {
          "method": "offline-witness-ed25519-v1",
          "witnessId": "synthetic-independent-witness-v1",
          "assertion": "EXISTENCE_BY",
          "witnessObservedAt": "2026-10-26T09:01:00Z",
          "scope": {
            "sourceId": "synthetic-source-v1",
            "evidenceKey": "synthetic-quality",
            "revision": 1,
            "kind": "QUALITY",
            "instrumentId": "11111111-1111-4111-8111-111111111111",
            "interval": {
              "startAt": "2026-10-23T00:00:00Z",
              "endAt": "2026-10-24T00:00:00Z"
            },
            "contentFingerprint": "5ca522c4f23f9516345932fcc933c6b821f129aead4e1aedc7421121eddbf9a3",
            "statementFingerprint": "94ce1fb6f83952ef7b50cc2fc3baf8e67f15068f800b0c0d9b4be8d306d894c8"
          },
          "signedAt": "2026-10-26T09:01:01Z",
          "keyId": "synthetic-witness-key-v1"
        },
        "signature": {
          "algorithm": "Ed25519",
          "canonicalization": "RFC8785-UTF8-v1",
          "keyId": "synthetic-witness-key-v1",
          "value": "AAAAAAAAAAAAAAAAAAAAAAAAAAAAAAAAAAAAAAAAAAAAAAAAAAAAAAAAAAAAAAAAAAAAAAAAAAAAAAAAAAAAAA=="
        }
      }
    }
  ]
}
