{
  "bundleVersion": "research-evidence-bundle-v1",
  "sourceId": "synthetic-source-v1",
  "policyVersion": "synthetic-policy-v1",
  "sourceDocumentFingerprint": "aaaaaaaaaaaaaaaaaaaaaaaaaaaaaaaaaaaaaaaaaaaaaaaaaaaaaaaaaaaaaaaa",
  "entries": [
    {
      "content": {
        "bundleVersion": "research-evidence-bundle-v1",
        "sourceId": "synthetic-source-v1",
        "policyVersion": "synthetic-policy-v1",
        "sourceDocumentFingerprint": "aaaaaaaaaaaaaaaaaaaaaaaaaaaaaaaaaaaaaaaaaaaaaaaaaaaaaaaaaaaaaaaa",
        "evidenceKey": "synthetic-corporate-action",
        "kind": "CORPORATE_ACTION",
        "instrumentId": "11111111-1111-4111-8111-111111111111",
        "interval": {
          "startAt": "2026-10-23T00:00:00Z",
          "endAt": "2026-10-24T00:00:00Z"
        },
        "sourceObservedAt": "2026-10-26T09:00:00Z",
        "publishedAt": null,
        "revision": 1,
        "predecessorFingerprint": null,
        "statement": {
          "type": "CORPORATE_ACTION_COVERAGE",
          "conclusion": "ACTIONS_PRESENT",
          "actions": [
            {
              "type": "SPLIT",
              "effectiveAt": "2026-10-23T13:30:00Z",
              "ratio": "2"
            },
            {
              "type": "CASH_DIVIDEND",
              "effectiveAt": "2026-10-23T13:30:00Z",
              "amount": "0.125",
              "currency": "USD"
            }
          ]
        },
        "signedAt": "2026-10-26T09:00:01Z",
        "keyId": "synthetic-source-key-v1"
      },
      "contentFingerprint": "7044b3bdbfaae21a0d5873fd303e3b78d29aae29e5dbbff77d455b9262262734",
      "signature": {
        "algorithm": "Ed25519",
        "canonicalization": "RFC8785-UTF8-v1",
        "keyId": "synthetic-source-key-v1",
        "value": "AAAAAAAAAAAAAAAAAAAAAAAAAAAAAAAAAAAAAAAAAAAAAAAAAAAAAAAAAAAAAAAAAAAAAAAAAAAAAAAAAAAAAA=="
      }
    }
  ]
}
